episode_id,url,title,summary
313,https://www.thisamericanlife.org/313/parental-guidance-suggested,Parental Guidance Suggested,Stories about kids who actually want their parents looking out for them.
314,https://www.thisamericanlife.org/314/its-never-over,It's Never Over,A grown man tries to get to the bottom of why his schoolmates threw him in a lake 20 years earlier.
315,https://www.thisamericanlife.org/315/the-parrot-and-the-potbellied-pig,The Parrot and the Potbellied Pig,"Stories about animals who don't even seem like they should know each other, much less appear on the same radio show."
316,https://www.thisamericanlife.org/316/the-cat-came-back,The Cat Came Back,"When something you thought was gone forever keeps returning, against all odds."
317,https://www.thisamericanlife.org/317/unconditional-love,Unconditional Love,"A family uses a controversial therapy to train their son to love them, and other stories about the hard work of loving other people."
318,https://www.thisamericanlife.org/318/with-great-power,With Great Power,Stories of everyday people who get saddled with great power.
319,https://www.thisamericanlife.org/319/and-the-call-was-coming-from-the-basement,And the Call Was Coming from the Basement,"Scary stories that are all true—zombie raccoons, haunted houses, and things that go ""EEEEK!!!"" in the night."
320,https://www.thisamericanlife.org/320/whats-in-a-number-2006-edition,What’s In A Number? — 2006 Edition,The remarkable story of what it took to determine the number of Iraqis who've died since the U.S. invasion.
321,https://www.thisamericanlife.org/321/sink-or-swim,Sink or Swim,Stories of people who are in over their heads and trying to stay afloat.
322,https://www.thisamericanlife.org/322/shouting-across-the-divide,Shouting Across the Divide,Stories of Muslims and non-Muslims trying to communicate with each other and not always getting their point across.
323,https://www.thisamericanlife.org/323/the-super,The Super,"The mysterious hold supers have on their buildings, or that their buildings have on them."
324,https://www.thisamericanlife.org/324/my-brilliant-plan,My Brilliant Plan,An American reporter in Iraq decides to rent a house in a residential Baghdad neighborhood. Plus other big ideas gone amok.
325,https://www.thisamericanlife.org/325/houses-of-ill-repute,Houses of Ill Repute,An old man in Brooklyn invites some homeless prostitutes into his house on a cold winter night. They never leave.
326,https://www.thisamericanlife.org/326/quiz-show,Quiz Show,A man with social anxiety goes through a transformation on a TV game show.
327,https://www.thisamericanlife.org/327/by-proxy,By Proxy,"Stories of proxy fights, proxy arguments, and proxy situations of all kinds."
328,https://www.thisamericanlife.org/328/what-i-learned-from-television,What I Learned from Television,"Stories recorded during our 2007 live tour, by Sarah Vowell, David Rakoff, Dan Savage, and others."
329,https://www.thisamericanlife.org/329/nice-work-if-you-can-get-it,Nice Work If You Can Get It,"Stories of sudden fame, quick riches, and the downside of the dream job."
330,https://www.thisamericanlife.org/330/my-reputation,My Reputation,Stories of people trying to recover from damage to their reputations.
331,https://www.thisamericanlife.org/331/habeas-schmabeas-2007,Habeas Schmabeas (2007),"Is Guantanamo Bay a camp full of terrorists, or a camp full of our mistakes?"
332,https://www.thisamericanlife.org/332/the-ten-commandments,The Ten Commandments,People struggling to follow the Ten Commandments from the book of Exodus.
333,https://www.thisamericanlife.org/333/the-center-for-lessons-learned,The Center for Lessons Learned,"Four years into the Iraq War, what have we learned?"
334,https://www.thisamericanlife.org/334/duty-calls,Duty Calls,"Josh's family didn't play much of a role in his daily life—until duty called, and they took over his life."
335,https://www.thisamericanlife.org/335/big-wide-world,Big Wide World,"When he was a teenager, Haider worked in the Iraqi Ministry of Information. He was treated like a celebrity."
336,https://www.thisamericanlife.org/336/who-can-you-save,Who Can You Save?,Stories about the pitfalls of trying to do the right thing.
337,https://www.thisamericanlife.org/337/man-vs-history,Man vs. History,Stories about people taking history into their own hands.
338,https://www.thisamericanlife.org/338/the-spokesman,The Spokesman,Stories of what can happen when you go from being a private person to a public face.
339,https://www.thisamericanlife.org/339/break-up,Break-Up,Stories from the heart of heartbreak.
340,https://www.thisamericanlife.org/340/the-devil-in-me,The Devil in Me,Stories of people trying to exorcize their inner demons.
341,https://www.thisamericanlife.org/341/how-to-talk-to-kids,How to Talk to Kids,Stories of adults taking very different approaches to communicating with children.
342,https://www.thisamericanlife.org/342/how-to-rest-in-peace,How to Rest in Peace,What happens to the people left behind after the detectives close the case?
343,https://www.thisamericanlife.org/343/poultry-slam-2007,Poultry Slam 2007,"Our annual program about turkeys, chickens, and fowl of all types."
344,https://www.thisamericanlife.org/344/the-competition,The Competition,Stories of the unintended consequences of market forces.
345,https://www.thisamericanlife.org/345/ties-that-bind,Ties That Bind,"A girl receives a heart transplant from a boy her age, and her mother sets off to find out more about the kid who saved her daughter's life."
346,https://www.thisamericanlife.org/346/home-alone,Home Alone,A 79-year-old woman dies alone in Los Angeles. No one knows her—or her next of kin.
347,https://www.thisamericanlife.org/347/matchmakers,Matchmakers,Making a lasting love match isn't as simple as writing a check.
348,https://www.thisamericanlife.org/348/tough-room,Tough Room,"We go into the writers' room at The Onion, where they start with over 600 potential headlines for their fake-news newspaper each week."
349,https://www.thisamericanlife.org/349/valentines-day-2008,Valentine’s Day 2008,Stories about couples that happen decades after the moment their eyes meet.
350,https://www.thisamericanlife.org/350/human-resources,Human Resources,"Teachers tell us about a secret room in the New York City Board of Education building called ""the rubber room."""
351,https://www.thisamericanlife.org/351/return-to-childhood-2008,Return to Childhood,People who try to revisit their childhoods—what they find and what they do not find.
352,https://www.thisamericanlife.org/352/the-ghost-of-bobby-dunbar,The Ghost of Bobby Dunbar,"In 1912, a four-year-old boy went missing in Louisiana. Eight months later, he was found. But two grief-stricken mothers both claimed the same boy as their own."
353,https://www.thisamericanlife.org/353/the-audacity-of-government,The Audacity of Government,Stories of the Bush Administration's quest to redefine the limits of presidential power.
354,https://www.thisamericanlife.org/354/mistakes-were-made,Mistakes Were Made,Freezing dead people so scientists can reanimate them in the future is a lot harder than it sounds.
355,https://www.thisamericanlife.org/355/the-giant-pool-of-money,The Giant Pool of Money,The surprisingly entertaining story of how the U.S. got itself into a housing crisis.
356,https://www.thisamericanlife.org/356/the-prosecutor,The Prosecutor,Things go badly for the lead prosecutor in one of the first high-profile terrorist cases since 9/11.
357,https://www.thisamericanlife.org/357/the-truth-will-out,The Truth Will Out,"Stories of concealed truths bubbling to the surface, including a new story by Etgar Keret."
358,https://www.thisamericanlife.org/358/social-engineering,Social Engineering,Stories of social engineering on a small scale.
359,https://www.thisamericanlife.org/359/life-after-death,Life After Death,Stories of people haunted by guilt over their role in others' deaths.
360,https://www.thisamericanlife.org/360/switched-at-birth,Switched at Birth,Two babies switched at birth. One of the moms knew but kept it a secret for 43 years. Then she told everybody.
361,https://www.thisamericanlife.org/361/fear-of-sleep,Fear of Sleep,Mike Birbiglia talks about the sleepwalking that nearly killed him.
362,https://www.thisamericanlife.org/362/got-you-pegged,Got You Pegged,"Shalom Auslander goes on vacation with his family, and suspects the chatty old man in the room next door is an imposter."
363,https://www.thisamericanlife.org/363/enforcers,Enforcers,Stories about people who take the law into their own hands.
364,https://www.thisamericanlife.org/364/going-big,Going Big,"Stories about people who take grand, sweeping approaches to solving problems of all sorts."
365,https://www.thisamericanlife.org/365/another-frightening-show-about-the-economy,Another Frightening Show About the Economy,A look at what regulators could've done to prevent the financial crisis from happening in the first place.
366,https://www.thisamericanlife.org/366/a-better-mousetrap-2008,A Better Mousetrap (2008),Stories about people trying to find new solutions to age-old problems.
367,https://www.thisamericanlife.org/367/ground-game,Ground Game,We go to Pennsylvania to figure out why both McCain and Obama think they can win there.
368,https://www.thisamericanlife.org/368/who-do-you-think-you-are,Who Do You Think You Are?,Stories of privilege and the lengths some will go to to maintain it.
369,https://www.thisamericanlife.org/369/poultry-slam-2008,Poultry Slam 2008,A man in Pakistan buys an amulet with the power to protect anyone from harm. He tests it out on a chicken.
370,https://www.thisamericanlife.org/370/ruining-it-for-the-rest-of-us,Ruining It for the Rest of Us,"Stories of people who ruin things for everyone else, or who are accused of that."
371,https://www.thisamericanlife.org/371/scenes-from-a-mall,Scenes From a Mall,We document life in a mall in Tennessee during the run-up to Christmas.
372,https://www.thisamericanlife.org/372/the-inauguration-show,The Inauguration Show,"On the eve of Obama's inauguration, we sent reporters out to talk to people about how they're feeling."
373,https://www.thisamericanlife.org/373/the-new-boss,The New Boss,Stories about what happens when someone new takes over—someone with a vision of how things ought to be.
375,https://www.thisamericanlife.org/375/bad-bank,Bad Bank,We tackle a very tough subject: Trying to explain exactly what a bank is and does.
376,https://www.thisamericanlife.org/376/wrong-side-of-history,Wrong Side of History,"Stories of people with wildly popular or unpopular views for one moment in time, and how those views stand up years later."
377,https://www.thisamericanlife.org/377/scenes-from-a-recession,Scenes From a Recession,We highlight the unusual circumstances our economic drought has left us in.
378,https://www.thisamericanlife.org/378/this-i-used-to-believe,This I Used to Believe,Stories of people forced to let go of their firmly held beliefs.
379,https://www.thisamericanlife.org/379/return-to-the-scene-of-the-crime,Return to the Scene of the Crime,"A live episode of the radio program, including stories told on stage by Dan Savage and Mike Birbiglia."
380,https://www.thisamericanlife.org/380/no-map,No Map,"Stories of people who find themselves in situations far from the beaten path, without guidelines or useful precedents."
381,https://www.thisamericanlife.org/381/turncoat,Turncoat,A well-known activist is accused of spying on other activists for the FBI.
382,https://www.thisamericanlife.org/382/the-watchmen,The Watchmen,Where were the regulators and watchdogs who were supposed to be overseeing the banks and the finance industry?
383,https://www.thisamericanlife.org/383/origin-story,Origin Story (2009),Little-known and surprising stories of how all sorts of institutions began.
384,https://www.thisamericanlife.org/384/fall-guy,Fall Guy,"When things go wrong, it's easy to pin it all on one person and watch them go down in flames."
385,https://www.thisamericanlife.org/385/pro-se,Pro Se,"It's tempting to act as your own lawyer, to argue your own cause."
386,https://www.thisamericanlife.org/386/fine-print,Fine Print,"Stories where the fine print changes everything, whether you read it or not."
387,https://www.thisamericanlife.org/387/arms-trader-2009,Arms Trader (2009),The U.S. government spent two years on a sting operation trapping an Indian man suspected of being an illegal arms dealer.
388,https://www.thisamericanlife.org/388/rest-stop,Rest Stop,Nine radio reporters. Two days. One rest stop on the New York State Thruway.
389,https://www.thisamericanlife.org/389/frenemies,Frenemies,"Tales of estranged sisters, BFFs breaking up, and how reality stars walk the fine line between making friends and getting famous."
390,https://www.thisamericanlife.org/390/return-to-the-giant-pool-of-money,Return To The Giant Pool of Money,We mark the anniversary of the economic collapse.
391,https://www.thisamericanlife.org/391/more-is-less,More Is Less,"An hour explaining the American health care system—specifically, why it is that costs keep rising."
392,https://www.thisamericanlife.org/392/someone-elses-money,Someone Else's Money,A deeper look inside the health insurance industry and the dark side of prescription drug coupons.
393,https://www.thisamericanlife.org/393/infidelity,Infidelity,"Stories of cheating, cheaters and the cheated."
394,https://www.thisamericanlife.org/394/bait-and-switch,Bait and Switch,The story of man who tries to investigate a neighborhood crime and ends up in jail himself.
395,https://www.thisamericanlife.org/395/middle-of-the-night,Middle of the Night,Stories of people who are up while the rest of us are sleeping.
396,https://www.thisamericanlife.org/396/1-party-school,#1 Party School,"The show goes to Penn State to report on tailgating, frat parties, and other alcohol-induced mayhem."
397,https://www.thisamericanlife.org/397/2010,2010,We asked our contributors to predict real events that will happen to them and the people they know in 2010.
398,https://www.thisamericanlife.org/398/long-shot,Long Shot,Stories of people betting on something with very bad odds.
399,https://www.thisamericanlife.org/399/contents-unknown,Contents Unknown,"A man finds himself in a train station in India, with no idea how he got there or who he is. That, and other stories of filling in the blank."
400,https://www.thisamericanlife.org/400/stories-pitched-by-our-parents,Stories Pitched by Our Parents,We try to turn their random ideas into actual stories.
401,https://www.thisamericanlife.org/401/parent-trap,Parent Trap,"A chimp is raised twice—once as a human child, and again as a chimp."
402,https://www.thisamericanlife.org/402/save-the-day,Save the Day,Stories about one person single-handedly taking charge of a situation gone wrong.
403,https://www.thisamericanlife.org/403/nummi,NUMMI (2010),A car plant in Fremont California that might have saved the U.S. car industry.
404,https://www.thisamericanlife.org/404/enemy-camp-2010,Enemy Camp (2010),"Living behind enemy lines, among the enemy, it's sometimes hard to remember why you're fighting in the first place."
405,https://www.thisamericanlife.org/405/inside-job,Inside Job,The inside story of one company that made hundreds of millions of dollars for itself while worsening the financial crisis for the rest of us.
406,https://www.thisamericanlife.org/406/true-urban-legends,True Urban Legends,Can a rat crawl through your plumbing and end up in your toilet?
407,https://www.thisamericanlife.org/407/the-bridge,The Bridge,"Stories of bridges from three different countries, including one in China that's famous for its massive size and its high suicide rate."
408,https://www.thisamericanlife.org/408/island-time,Island Time,Blanketing a country in aid and money has never really worked so well. Is there a chance things could be different in Haiti?
409,https://www.thisamericanlife.org/409/held-hostage,Held Hostage,"Stories of people held captive — by criminals, by paperwork, and in one man's case, his own body — and the ways they try to cope."
410,https://www.thisamericanlife.org/410/social-contract,Social Contract,"Richard Ravitch has helped fix three governmental crises, so what makes it so much harder for him to solve the state's current financial crisis?"
411,https://www.thisamericanlife.org/411/first-contact,First Contact,"Stories of first encounters with unknown and distant beings—girls, foreigners, and perhaps even aliens."
412,https://www.thisamericanlife.org/412/million-dollar-idea,Million Dollar Idea,Michael Larson made the most money ever on the game show Press Your Luck. And it was no accident.
413,https://www.thisamericanlife.org/413/georgia-rambler,Georgia Rambler,Nine of us go to small towns in Georgia to ask around until we find stories.
414,https://www.thisamericanlife.org/414/right-to-remain-silent,Right to Remain Silent,A New York police officer secretly records his supervisors ordering officers to do all sorts of things that police aren't supposed to do.
415,https://www.thisamericanlife.org/415/crybabies,Crybabies,"Stories of crybabies in sports, in politics, on Wall Street, on the streets of California."
416,https://www.thisamericanlife.org/416/iraq-after-us,Iraq After Us,We spend a month in Iraq talking to Iraqis and Americans about the war that tore the country apart.
417,https://www.thisamericanlife.org/417/this-party-sucks,This Party Sucks,Two best friends get tired of yelling at their TVs and decide to form a Tea Party chapter to effect political change.
418,https://www.thisamericanlife.org/418/toxie,Toxie,Reporters from Planet Money bought a toxic asset that turned out to be an encyclopedia of the financial crisis.
419,https://www.thisamericanlife.org/419/petty-tyrant,Petty Tyrant,"The rise and fall of a school maintenance man in Schenectady, New York who terrorized his staff and got away with it for decades."
420,https://www.thisamericanlife.org/420/neighborhood-watch,Neighborhood Watch,"Stories of neighbors watching out for each other, for better and worse."
421,https://www.thisamericanlife.org/421/last-man-standing,Last Man Standing,"Stories about people who feel compelled to keep going, especially when everyone else has given up."
422,https://www.thisamericanlife.org/422/comedians-of-christmas-comedy-special,Comedians of Christmas Comedy Special,The holidays are stressful so we booked a seasonal pick-me-up: an hour of comedy.
423,https://www.thisamericanlife.org/423/the-invention-of-money,The Invention of Money,Five reporters stumbled on what seems like a basic question: What is money?
424,https://www.thisamericanlife.org/424/kid-politics,Kid Politics,"When it comes to governing, can kids do any better than grown-ups?"
425,https://www.thisamericanlife.org/425/slow-to-react,Slow To React,The story of a wedding 17 years in the making.
426,https://www.thisamericanlife.org/426/tough-room-2011,Tough Room 2011,We go backstage with comedy writers at The Onion.
427,https://www.thisamericanlife.org/427/original-recipe,Original Recipe,"We think we may have found the original recipe for Coca-Cola, one of the most guarded trade secrets in the world."
428,https://www.thisamericanlife.org/428/oh-you-shouldnt-have,Oh You Shouldn't Have,Stories about the perils of giving and receiving gifts.
429,https://www.thisamericanlife.org/429/will-they-know-me-back-home,Will They Know Me Back Home?,Stories of people who've grown so accustomed to wartime that the lives they've left behind no longer make sense.
430,https://www.thisamericanlife.org/430/very-tough-love,Very Tough Love,A drug court program in Georgia where people with offenses that would get minimal or no sentences elsewhere sometimes end up in the system five to ten years.
431,https://www.thisamericanlife.org/431/see-no-evil,See No Evil,Stories of people pretending that everything is okay and ignoring the awful stuff that's staring them straight in the face.
432,https://www.thisamericanlife.org/432/know-when-to-fold-em,Know When To Fold ‘Em,The story of an entire country deciding whether to give up on just one of its citizens.
433,https://www.thisamericanlife.org/433/fine-print-2011,Fine Print 2011,"Stories where the fine print changes everything, whether you read it or not."
434,https://www.thisamericanlife.org/434/this-week,This Week,An hour of stories about...this week.
435,https://www.thisamericanlife.org/435/how-to-create-a-job,How To Create a Job,Can politicians truly create many jobs?
436,https://www.thisamericanlife.org/436/the-psychopath-test,The Psychopath Test,"We heard about a test that could determine if someone was a psychopath. So, naturally, our staff decided to take it."
437,https://www.thisamericanlife.org/437/old-boys-network,Old Boys Network,"Nurses at a small Texas hospital report a well-connected doctor for dangerous medical practices, and find themselves under arrest."
438,https://www.thisamericanlife.org/438/fathers-day-2011,Father's Day 2011,Surprising stories of fathers trying to be good dads.
439,https://www.thisamericanlife.org/439/a-house-divided,A House Divided,Stories about people who find themselves either unexpectedly being singled out or doing the singling out.
440,https://www.thisamericanlife.org/440/game-changer,Game Changer,Two professors each make a calculation that no one had made before.
441,https://www.thisamericanlife.org/441/when-patents-attack,When Patents Attack!,"Why would a company rent an office in a tiny town in East Texas, put a nameplate on the door, and leave it completely empty for a year?"
442,https://www.thisamericanlife.org/442/thugs,Thugs,"Like a lot of Mexican towns, Florencia has had its share of problems dealing with drug gangs. Until recently, when new narcos rolled into town."
443,https://www.thisamericanlife.org/443/amusement-park,Amusement Park,We head to some of the happiest places on earth: amusement parks!
444,https://www.thisamericanlife.org/444/gossip,Gossip,A sociologist collects journals filled with gossip about AIDS in Malawi.
445,https://www.thisamericanlife.org/445/ten-years-in,Ten Years In,"We return to people who have been on the show in the last ten years, and whose lives were drastically altered by 9/11."
446,https://www.thisamericanlife.org/446/living-without-2011,Living Without (2011),A man has to give up parts of his life as he learns to live hearing a tone in his head all the time.
447,https://www.thisamericanlife.org/447/the-incredible-case-of-the-pi-moms,The Incredible Case of the P.I. Moms,"What do you get when you take a P.I. firm, then add in a bunch of sexy soccer moms, official sponsorship from Glock, a lying boss, and delusions of grandeur? This week's show."
448,https://www.thisamericanlife.org/448/adventure,Adventure!,Stories that pinpoint when people's boring old lives turn into something wildly unfamiliar.
449,https://www.thisamericanlife.org/449/middle-school,Middle School,"Stories from the awkward, confusing, hormonally charged world of middle school."
450,https://www.thisamericanlife.org/450/so-crazy-it-just-might-work,So Crazy It Just Might Work,An orchestra teacher has a theory that he could kill cancer cells with electromagnetic waves.
451,https://www.thisamericanlife.org/451/back-to-penn-state,Back to Penn State,Penn State fans and loyalists try to make sense of the actions of Coach Joe Paterno and school officials.
452,https://www.thisamericanlife.org/452/poultry-slam-2011,Poultry Slam 2011,Stories of what happens when humans and fowl collide.
453,https://www.thisamericanlife.org/453/nemeses,Nemeses,"A college rivalry goes viral, and personal."
454,https://www.thisamericanlife.org/454/mr-daisey-and-the-apple-factory,Promo Mr. Daisey and the Apple Factory,This American Life has retracted this story.
455,https://www.thisamericanlife.org/455/continental-breakup,Continental Breakup,The story of the European debt crisis is actually very surprising and dramatic.
456,https://www.thisamericanlife.org/456/reap-what-you-sow,Reap What You Sow,"Alabama's new immigration law aims to make life so difficult for illegal immigrants that they will ""self-deport."""
457,https://www.thisamericanlife.org/457/what-i-did-for-love,What I Did For Love,"A couple decides they need to sleep with other people before getting married, and a teenage boy falls for an undercover cop."
458,https://www.thisamericanlife.org/458/play-the-part,Play the Part,Stories of people who decide to flip their personalities and do the exact opposite of what they normally do.
459,https://www.thisamericanlife.org/459/what-kind-of-country,What Kind of Country,"All across the country right now, local and state governments are finding they can't pay their bills."
460,https://www.thisamericanlife.org/460/retraction,Retraction,"We've discovered that one of our most popular episodes contained numerous fabrications. This week, we detail the errors in Mike Daisey's story about visiting Foxconn, which makes iPads and other products for Apple in China. Marketplace's China correspondent Rob Schmitz discovered the fabrications. Transcript. Press Release."
461,https://www.thisamericanlife.org/461/take-the-money-and-run-for-office,Take the Money and Run for Office,Discovering just how much time members of Congress spend raising money.
462,https://www.thisamericanlife.org/462/own-worst-enemy,Own Worst Enemy,Stories of people who can’t seem to stop getting in their own way.
463,https://www.thisamericanlife.org/463/mortal-vs-venial,Mortal Vs. Venial,"Religion makes clear the difference between mortal sins and venial ones. But in our everyday lives, it can be really difficult to determine just how bad we've been."
464,https://www.thisamericanlife.org/464/invisible-made-visible,Invisible Made Visible,"David Sedaris, Tig Notaro, Ryan Knighton, and the late David Rakoff in his final performance on the show."
