episode_id,url,title,summary
161,https://www.thisamericanlife.org/161/million-bubbles,Million Bubbles,A look at what's going on inside the individual glass and steel worlds of our cars.
162,https://www.thisamericanlife.org/162/moving,Moving,Stories of people who did not want to move but circumstance forced their hands.
163,https://www.thisamericanlife.org/163/can-you-fight-city-hallif-you-are-city-hall,Can You Fight City Hall…If You Are City Hall?,"Stories of people who stand up alone for what's right, damn the consequences."
164,https://www.thisamericanlife.org/164/crime-scene,Crime Scene (2000),Crime scenes and the stories they tell.
165,https://www.thisamericanlife.org/165/americans-in-paris,Americans in Paris,David Sedaris takes Ira on a tour of his favorite spots in Paris.
166,https://www.thisamericanlife.org/166/nobodys-family-is-going-to-change,Nobody's Family Is Going to Change,Does anyone's family ever change?
167,https://www.thisamericanlife.org/167/memo-to-the-people-of-the-future,Memo to the People of the Future,Stories of people who are trying to control how they'll be seen by generations to come.
168,https://www.thisamericanlife.org/168/the-fix-is-in,The Fix Is In,We go inside the back rooms of one multinational corporation and hear the intricate workings of how they put the fix in.
169,https://www.thisamericanlife.org/169/pursuit-of-happiness,Pursuit of Happiness,What does it mean to grow up in a country with an inalienable right to pursue happiness?
170,https://www.thisamericanlife.org/170/immigration,Immigration,"We look at a 1996 immigration law that is too obscure for most of us to have heard of, but which affects tens of thousands of lives in huge ways."
171,https://www.thisamericanlife.org/171/election,Election,"Stories for the eve of the 2000 presidential election, in which we try to look beneath the candidates' soundbites."
172,https://www.thisamericanlife.org/172/24-hours-at-the-golden-apple,24 Hours at the Golden Apple,One day in a Chicago diner.
173,https://www.thisamericanlife.org/173/three-kinds-of-deception,Three Kinds of Deception,"A story of self-deception, a story about deceiving others, and a story about accidental deception."
174,https://www.thisamericanlife.org/174/birthdays-anniversaries-and-milestones,"Birthdays, Anniversaries, and Milestones",A live show taped for our fifth anniversary.
175,https://www.thisamericanlife.org/175/babysitting,Babysitting,"A brother and sister decide to invent children to babysit, as an excuse to get out of their own house."
176,https://www.thisamericanlife.org/176/two-nations-one-president,"Two Nations, One President","Democrats explain why they're having trouble getting over the 2001 election, and Republicans explain why this is so infuriating."
177,https://www.thisamericanlife.org/177/american-limbo,American Limbo,Stories of people living completely outside the grid of American life.
178,https://www.thisamericanlife.org/178/superpowers,Superpowers,Which is better: flight or invisibility?
179,https://www.thisamericanlife.org/179/cicero,Cicero,"The story of what was, at one time, one of most notoriously racist and corrupt suburbs in America."
180,https://www.thisamericanlife.org/180/return-to-childhood,Return to Childhood 2001,"Alex Blumberg tries to find a woman who babysat him when he was nine, and other stories of people trying to revisit their childhoods."
181,https://www.thisamericanlife.org/181/the-friendly-man,The Friendly Man,"Stories from Scott Carrier, whose strange and compelling tales sound like nothing else on the radio."
182,https://www.thisamericanlife.org/182/cringe,Cringe,"Tales of personal humiliation, romance gone wrong, and people who profoundly misjudge how they're perceived by others."
183,https://www.thisamericanlife.org/183/the-missing-parents-bureau,The Missing Parents Bureau,Women planning to get pregnant with the help of a sperm bank tell us about the questions they wrestle with of how much they want to know about the fathers of their kids.
184,https://www.thisamericanlife.org/184/neighbors,Neighbors,"An average Chicagoan decides to appeal the disputes and problems in his neighborhood to a higher authority, Mr. Rogers. Yes, that Mr. Rogers."
185,https://www.thisamericanlife.org/185/golden-calf,Golden Calf,"Stories of people worshiping false idols, and whether that's always a bad thing."
186,https://www.thisamericanlife.org/186/prom,Prom,"While the seniors danced at Prom Night 2001 in Hoisington, Kansas—a town of about 3,000—a tornado hit the town."
187,https://www.thisamericanlife.org/187/fathers-day-01,Father's Day '01,Stories of dads who are utterly human in scale.
188,https://www.thisamericanlife.org/188/kid-logic,Kid Logic (2001),"Stories of kids using perfectly logical arguments, and arriving at perfectly wrong conclusions."
189,https://www.thisamericanlife.org/189/hitlers-yacht,Hitler’s Yacht,"A modern-day fable about what happens when the free market, the media, the World War II buffs, the Neo-Nazis, and the Jews all collide over a huge Nazi tourist trap."
190,https://www.thisamericanlife.org/190/living-the-dream,Living the Dream,There's a deep impulse in American culture that says that you can make yourself into anyone.
191,https://www.thisamericanlife.org/191/i-know-what-you-did-this-summer,I Know What You Did This Summer,"Scott Carrier travels cross-country without air conditioning, during weather in which it's too hot to stay in the car and too hot to get out."
192,https://www.thisamericanlife.org/192/meet-the-pros,Meet the Pros,The story of one man's journey from obscurity to international professional celebrity.
193,https://www.thisamericanlife.org/193/stories-of-loss,Stories of Loss,A collection of stories in which people try to make sense of loss.
194,https://www.thisamericanlife.org/194/before-and-after,Before and After,"Stories in the wake of the events of September 11, 2001."
195,https://www.thisamericanlife.org/195/war-stories,War Stories,We try to sort out what the war in Afghanistan will be like.
196,https://www.thisamericanlife.org/196/rashomon,Rashomon,"The events of September 11th, and how its meaning changes depending on who you talk to."
197,https://www.thisamericanlife.org/197/before-it-had-a-name,Before It Had A Name,"In 1946, a man started to investigate the Holocaust before it was known as the Holocaust, gathering the first recorded testimonials of concentration camp survivors."
198,https://www.thisamericanlife.org/198/how-to-win-friends-and-influence-people,How to Win Friends and Influence People,People climbing to be number one. How do they do it?
199,https://www.thisamericanlife.org/199/house-on-loon-lake,House on Loon Lake,"A young boy, an abandoned house, and the mysterious family who disappeared without a trace."
200,https://www.thisamericanlife.org/200/hearts-and-minds,Hearts and Minds,"Of all the wars to win, perhaps the propaganda war is the hardest."
201,https://www.thisamericanlife.org/201/them,Them,"In a time of war, when we're all feeling a heightened sense of ""us"" and ""them,"" we wanted to take up the problem of ""them."""
202,https://www.thisamericanlife.org/202/faith,Faith,"Stories of faith: losing it, talking about it, constructing it, and working within it."
203,https://www.thisamericanlife.org/203/recordings-for-someone,Recordings for Someone,Personal recordings one person made for just one other person.
204,https://www.thisamericanlife.org/204/81-words,81 Words,How the American Psychiatric Association decided that homosexuality was no longer a mental illness.
205,https://www.thisamericanlife.org/205/plan-b,Plan B,"There's the thing you plan to do, and then there's the thing you end up doing."
206,https://www.thisamericanlife.org/206/somewhere-in-the-arabian-sea,Somewhere in the Arabian Sea,Life aboard an aircraft carrier stationed in the Arabian Sea supporting bombing missions over Afghanistan.
207,https://www.thisamericanlife.org/207/special-ed,Special Ed,Stories about people who were told that they're different.
208,https://www.thisamericanlife.org/208/office-politics,Office Politics,Stories of high drama from our nation's workplaces.
209,https://www.thisamericanlife.org/209/didnt-ask-to-be-born,Didn’t Ask to Be Born,"The story of an eighth grader who set himself on fire, and what led to that."
210,https://www.thisamericanlife.org/210/perfect-evidence,Perfect Evidence,"DNA evidence isn't just proving wrongdoing by criminals, it's proving wrongdoing by police and prosecutors."
211,https://www.thisamericanlife.org/211/naming-names,Naming Names,"When you turn someone over to the authorities, it can set into motion lots of huge, unintended consequences."
212,https://www.thisamericanlife.org/212/the-other-man,The Other Man,Stories about what happens when a new guy comes on the scene and changes everything.
213,https://www.thisamericanlife.org/213/devil-on-my-shoulder,Devil on My Shoulder,"Stories of people who try to convince you that the devil is there, whispering in your ear."
214,https://www.thisamericanlife.org/214/family-physics,Family Physics,We take the laws of physics and apply them to the realm of human relationships.
215,https://www.thisamericanlife.org/215/ask-an-expert,Ask An Expert,Stories about people who turned to the experts and got horrible advice.
216,https://www.thisamericanlife.org/216/give-the-people-what-they-want,Give the People What They Want,Ira Glass goes to a fake wedding at a home for Alzheimer's patients.
217,https://www.thisamericanlife.org/217/give-it-to-them,Give It to Them,"Two years after the Mideast peace process collapsed, we wanted to understand what that has done to people living in Israel and the West Bank."
218,https://www.thisamericanlife.org/218/act-v,Act V,A group of inmates at a high-security prison stage a production of the last act of Hamlet.
219,https://www.thisamericanlife.org/219/high-speed-chase,High Speed Chase,What happened after a group of Native American girls from one town found themselves being chased down the highway by a group of white boys from another town.
220,https://www.thisamericanlife.org/220/testosterone,Testosterone,The pros and cons of the hormone of desire.
221,https://www.thisamericanlife.org/221/fake-id,Fake I.D.,"Stories of people traveling under false identities, not for power or personal gain, but for their own deeper personal reasons."
222,https://www.thisamericanlife.org/222/suckers,Suckers,Some people have a rather dark worldview that divides people into two groups: Suckers and non-suckers.
223,https://www.thisamericanlife.org/223/classifieds,Classifieds,We take the classifieds from one Sunday edition of the paper and fill a program with stories that come from the ads.
224,https://www.thisamericanlife.org/224/middlemen,Middlemen,"""Hi, middleman. Here are three splendid acts to toast your subtle virtues."""
225,https://www.thisamericanlife.org/225/home-movies,Home Movies,"Home movies are often all the same—kids on the beach, people getting married, birthday parties—so why do we make and watch so many of them?"
226,https://www.thisamericanlife.org/226/reruns,Reruns,Stories of people stuck in moments that they revisit over and over again.
227,https://www.thisamericanlife.org/227/why-we-fight,Why We Fight,We still have some basic questions about why we're going to war and whether it's a good thing.
228,https://www.thisamericanlife.org/228/you-are-so-beautifulto-me,You Are So Beautiful…To Me,Two modern-day reinterpretations of the Frog Prince story.
229,https://www.thisamericanlife.org/229/secret-government,Secret Government,"Stories of some of the secrets our government keeps: of imprisonment, deportation, and spying."
230,https://www.thisamericanlife.org/230/come-back-to-afghanistan,Come Back to Afghanistan,A California teenager returns to the home country he's never known.
231,https://www.thisamericanlife.org/231/time-to-save-the-world,Time to Save the World,Stories of sudden truths delivered by complete strangers.
232,https://www.thisamericanlife.org/232/the-real-story,The Real Story,Real stories from three very different wars.
233,https://www.thisamericanlife.org/233/starting-from-scratch,Starting From Scratch,"A man in retirement tries to start over in a new life with a new venture: a cable channel, with lots of puppies."
234,https://www.thisamericanlife.org/234/say-anything,Say Anything,Does talking about it really help?
235,https://www.thisamericanlife.org/235/the-balloon-goes-up,The Balloon Goes Up,"Stories from the beginnings of the war in Iraq, and how it compares with wars in our country's past."
236,https://www.thisamericanlife.org/236/my-two-cents,My Two Cents,"We try to figure out the paradox of the current economy, where Americans are simultaneously both losing jobs and buying new homes and cars."
237,https://www.thisamericanlife.org/237/regime-change,Regime Change,Stories of regime change in everyday life.
238,https://www.thisamericanlife.org/238/lost-in-translation,Lost in Translation,"Jonathan Goldstein and Starlee Kine go to a karaoke club that has, along with all the songs, comedy routines for people to perform."
239,https://www.thisamericanlife.org/239/lost-in-america,Lost in America,"Stories of people who are lost, histories that are lost, and things that are lost."
240,https://www.thisamericanlife.org/240/im-in-charge-now,I’m In Charge Now,There is a ominous information gap between the U.S. officials running the country and the Iraqi people being governed.
241,https://www.thisamericanlife.org/241/20-acts-in-60-minutes,20 Acts in 60 Minutes,All kinds of little stories that we ordinarily can't use on the radio show because they are just too short.
242,https://www.thisamericanlife.org/242/enemy-camp,Enemy Camp,The story of a fixer for the Catholic Church and how he came to sympathize with the people that he was sent to deceive.
243,https://www.thisamericanlife.org/243/later-that-same-day,Later That Same Day,Stories about what the passage of time can do to someone.
244,https://www.thisamericanlife.org/244/macgyver,MacGyver,Four real stories in which real people invent amazingly clever solutions to their problems.
245,https://www.thisamericanlife.org/245/allure-of-the-mean-friend,Allure of the Mean Friend,"They treat us poorly, they don't call us back, they cancel plans at the last minute, and yet we keep coming back for more."
246,https://www.thisamericanlife.org/246/my-pen-pal,My Pen Pal,"Stories of very unusual pen pals, people whose relationship could not exist without the help of the postal service."
247,https://www.thisamericanlife.org/247/what-is-this-thing,What Is This Thing?,"What is this thing called love? For answers, we explore the romance novel industry, a $1.5 billion empire run almost entirely by and for women."
248,https://www.thisamericanlife.org/248/like-it-or-not,Like It or Not,David Rakoff guest hosts.
249,https://www.thisamericanlife.org/249/garbage,Garbage,"We follow the trash from the sanitation men on the street, to the mob guys who controlled the hauling business, to the people who actually live in dumps."
250,https://www.thisamericanlife.org/250/the-annoying-gap-between-theoryand-practice,The Annoying Gap Between Theory...and Practice,Why is it always harder than you think it'll be?
251,https://www.thisamericanlife.org/251/brothers-keeper,Brother’s Keeper,"In his ongoing effort to write his own version of the Bible, Jonathan Goldstein retells the story of Cain and Abel."
252,https://www.thisamericanlife.org/252/poultry-slam-2003,Poultry Slam 2003,"Turkeys, chickens, geese, ducks, fowl of all kinds, real and imagined, and their mysterious hold over us."
253,https://www.thisamericanlife.org/253/the-middle-of-nowhere,The Middle of Nowhere,The tiny island of Nauru is at the center of several of the decade's biggest global events.
254,https://www.thisamericanlife.org/254/teenage-embed-part-two,"Teenage Embed, Part Two",Hyder returns to Afghanistan.
255,https://www.thisamericanlife.org/255/this-american-lifes-holiday-gift-giving-guide,Our Holiday Gift-Giving Guide,The vexing difficulty of finding the perfect gift.
256,https://www.thisamericanlife.org/256/living-without,Living Without (2004),Sarah Vowell explains the cheerful journalism of deprivation. And other stories.
257,https://www.thisamericanlife.org/257/what-i-shouldve-said,What I Should’ve Said,People return to the scene of the crime where they should have spoken clearly and forcefully to review what the hell went wrong.
258,https://www.thisamericanlife.org/258/leaving-the-fold,Leaving the Fold (2004),People leaving the situation they're used to and striking off for something less familiar.
259,https://www.thisamericanlife.org/259/promised-land,Promised Land,David Rakoff tries a 20-day fast to see if it will bring him any form of enlightenment.
260,https://www.thisamericanlife.org/260/the-facts-dont-matter,The Facts Don’t Matter,How a bungled Nazi sabotage operation became the legal foundation for the Bush administration's push to try U.S. citizens in military tribunals.
261,https://www.thisamericanlife.org/261/the-sanctity-of-marriage,The Sanctity of Marriage,A generation of researchers has revolutionized the way we see marriage.
262,https://www.thisamericanlife.org/262/miracle-cures,Miracle Cures,A son tries to help his mom in a faraway place defy the laws of medical science.
263,https://www.thisamericanlife.org/263/desperate-measures,Desperate Measures,Stories of people stuck in unfixable situations who try desperate measures.
264,https://www.thisamericanlife.org/264/special-treatment,Special Treatment,"A defense of special treatment, by people who receive it and people who give it."
265,https://www.thisamericanlife.org/265/fake-science,Fake Science,A Seattle group called AGHOST is using whatever scientific principles they can find to hunt for ghosts.
266,https://www.thisamericanlife.org/266/im-from-the-private-sector-and-im-here-to-help,I'm From the Private Sector and I'm Here to Help,Nancy Updike goes to Iraq to try to figure out what it's like to be a private citizen working in the middle of a war zone.
267,https://www.thisamericanlife.org/267/propriety,Propriety,"By tightening the rules on what swear words are allowed on the nation's airwaves, FCC officials say they're protecting kids. But the facts don't back them up."
268,https://www.thisamericanlife.org/268/my-experimental-phase,My Experimental Phase,People who decide to try out a new life—the kind of life their parents never wanted for them.
269,https://www.thisamericanlife.org/269/someone-to-watch-over-me,Someone to Watch Over Me,Letting someone else take care of you can change everything.
270,https://www.thisamericanlife.org/270/family-legend,Family Legend,"Every family has its share of grudges, secrets, and bad behavior."
271,https://www.thisamericanlife.org/271/best-interests,Best Interests,Stories about adults struggling to figure out what is in the best interest of some child.
272,https://www.thisamericanlife.org/272/big-tent,Big Tent,We leave behind the official Republican talking points and ask them to speak instead about what they actually believe.
273,https://www.thisamericanlife.org/273/put-your-heart-in-it,Put Your Heart In It,Stories about people deciding whether to give it their all.
274,https://www.thisamericanlife.org/274/enemy-camp-04,Enemy Camp (2004),"Behind enemy lines, sometimes people get confused about whose side they're on and how to fight the enemy."
275,https://www.thisamericanlife.org/275/two-steps-back,Two Steps Back,The rise and fall of school reform.
276,https://www.thisamericanlife.org/276/swing-set,Swing Set,A journey through the minds of undecided voters.
277,https://www.thisamericanlife.org/277/apology,Apology,It's rare that a successful apology happens.
278,https://www.thisamericanlife.org/278/spies-like-us,Spies Like Us,A woman starts hearing her neighbors making drug deals over her baby monitor's frequency.
279,https://www.thisamericanlife.org/279/auto-show,Auto Show,"Stories about people who love their cars, for better or for worse."
280,https://www.thisamericanlife.org/280/in-country,In Country,What life is like for American soldiers in Iraq.
281,https://www.thisamericanlife.org/281/my-big-break,My Big Break,"Sometimes, getting your big break isn't all it's cracked up to be."
282,https://www.thisamericanlife.org/282/diy,DIY,"After four lawyers fail to get an innocent man out of prison, his friend takes on the case himself."
283,https://www.thisamericanlife.org/283/remember-me,Remember Me,"A dying mother makes a tape for her developmentally disabled daughter, hoping she'll watch it someday, knowing she might not."
284,https://www.thisamericanlife.org/284/should-i-stay-or-should-i-go,Should I Stay or Should I Go?,"A software writer loses his job, but continues to show up at work, sneaking in the door each day and putting in long hours."
285,https://www.thisamericanlife.org/285/know-your-enemy,Know Your Enemy,An LA prosecutor thought he'd make a name for himself by taking the lead singer of the Dead Kennedys to court for obscenity.
286,https://www.thisamericanlife.org/286/mind-games,Mind Games (2005),"Stories of people who try simple mind games on others, and then find themselves way in over their heads."
287,https://www.thisamericanlife.org/287/backed-into-a-corner,Backed Into A Corner,"Stories about people who end up making choices they'd rather not make, when their options begin to run out."
288,https://www.thisamericanlife.org/288/not-what-i-meant,Not What I Meant,"Stories about how easy it is for communication to go awry, and what the consequences can be after it does."
289,https://www.thisamericanlife.org/289/go-ask-your-father,Go Ask Your Father,Sons and daughters get to find out the one thing they've always wanted to know about their father.
290,https://www.thisamericanlife.org/290/godless-america,Godless America,We spend an hour trying to remember why anyone liked the separation of church and state in the first place.
291,https://www.thisamericanlife.org/291/reunited-and-it-feels-so-good,Reunited (And It Feels So Good),"Stories about getting back together with your parent, your spouse, your ... Brahman bull."
292,https://www.thisamericanlife.org/292/the-arms-trader,The Arms Trader (2005),The U.S. government spent two years on a sting operation trapping an Indian man named Hemant Lakhani.
293,https://www.thisamericanlife.org/293/a-little-bit-of-knowledge,A Little Bit of Knowledge,Stories about the pitfalls of knowing just a little bit too little.
294,https://www.thisamericanlife.org/294/image-makers,Image Makers,Some librarians in Michigan embark on an audacious act of rebranding their libraries.
295,https://www.thisamericanlife.org/295/not-what-i-signed-up-for,Not What I Signed Up For,A 9/11 widow finds herself having to comfort another distraught woman on national TV.
296,https://www.thisamericanlife.org/296/after-the-flood,After the Flood,Surprising stories from survivors in New Orleans.
297,https://www.thisamericanlife.org/297/this-is-not-my-beautiful-house,This Is Not My Beautiful House,"Stories from the largest mass resettlement that America has seen since the Civil War, as over 400,000 people—victims of Hurricane Katrina."
298,https://www.thisamericanlife.org/298/getting-and-spending,Getting and Spending,"How far will we go to get money? And once we've got it, what should we spend it on?"
299,https://www.thisamericanlife.org/299/back-from-the-dead,Back from the Dead,Stories about people and places that have come back to life after everything seemed lost.
300,https://www.thisamericanlife.org/300/whats-in-a-number,What’s In A Number?,"A study estimated the number of Iraqi casualties since the war began at 100,000. Most of the deaths were caused by coalition forces."
301,https://www.thisamericanlife.org/301/settling-the-score,Settling the Score,"Stories about the lengths we go to make things right, and about what money can and cannot fix."
302,https://www.thisamericanlife.org/302/strangers-in-a-strange-land,Strangers in a Strange Land,"Three people tell their stories from Iraq about the fighting, the locals, and why you subscribe to Details magazine."
303,https://www.thisamericanlife.org/303/david-and-goliath,David and Goliath,"Variations on an old tale, with very modern consequences."
304,https://www.thisamericanlife.org/304/heretics,Heretics,A rising star in the evangelical movement casts aside the idea of hell.
305,https://www.thisamericanlife.org/305/the-this-american-life-holiday-spectacular,The This American Life Holiday Spectacular,"A full-throttle, show-stopping, no-holds-barred Christmas Spectacular!"
306,https://www.thisamericanlife.org/306/seemed-like-a-good-idea-at-the-time,Seemed Like A Good Idea at the Time,Lotto fever grips the cast of Riverdance.
307,https://www.thisamericanlife.org/307/in-the-shadow-of-the-city,In the Shadow of the City (2006),"Stories that take place on the edge of civilization, just out of sight."
308,https://www.thisamericanlife.org/308/star-crossed-love,Star-Crossed Love,"Stories of how love blossoms, even when (perhaps) it shouldn't."
309,https://www.thisamericanlife.org/309/cat-and-mouse,Cat and Mouse,Stories about the kinds of chase games that just never end.
310,https://www.thisamericanlife.org/310/habeas-schmabeas,Habeas Schmabeas,"Is Guantanamo Bay a camp full of terrorists, or a camp full of our mistakes?"
311,https://www.thisamericanlife.org/311/a-better-mousetrap,A Better Mousetrap (2006),Stories about people trying to find new solutions to age-old problems.
312,https://www.thisamericanlife.org/312/how-we-talked-back-then,How We Talked Back Then,"We revisit two live shows we put on in the early days—one was about letters, and the other was about this then-new phenomenon called the internet."
